[
  {
    "evaluator": "farai",
    "dimension": "F",
    "value": 3,
    "anchor": 3,
    "signals": [
      "farai.01",
      "farai.02",
      "farai.10",
      "farai.12",
      "farai.14"
    ],
    "rationale": "Anchor 3 on funding given the cited signals.",
    "assessed": "2026-09-15",
    "assessor": "yohei/claude v1.0"
  },
  {
    "evaluator": "farai",
    "dimension": "G",
    "value": 3,
    "anchor": 3,
    "signals": [
      "farai.05"
    ],
    "rationale": "Anchor 3 on governance given the cited signals.",
    "assessed": "2026-09-14",
    "assessor": "yohei/claude v0"
  },
  {
    "evaluator": "farai",
    "dimension": "P",
    "value": 3,
    "anchor": 3,
    "signals": [
      "farai.07"
    ],
    "rationale": "Anchor 3 on personnel given the cited signals.",
    "assessed": "2026-09-14",
    "assessor": "yohei/claude v0"
  },
  {
    "evaluator": "farai",
    "dimension": "A",
    "value": 3,
    "anchor": 3,
    "signals": [
      "farai.06"
    ],
    "rationale": "Anchor 3 on access given the cited signals.",
    "assessed": "2026-09-14",
    "assessor": "yohei/claude v0"
  },
  {
    "evaluator": "farai",
    "dimension": "S",
    "value": 3,
    "anchor": 3,
    "signals": [
      "farai.03",
      "farai.11",
      "farai.13"
    ],
    "rationale": "Anchor 3 on scope given the cited signals.",
    "assessed": "2026-09-15",
    "assessor": "yohei/claude v1.0"
  },
  {
    "evaluator": "farai",
    "dimension": "R",
    "value": 3,
    "anchor": 3,
    "signals": [
      "farai.04"
    ],
    "rationale": "Anchor 3 on publication given the cited signals.",
    "assessed": "2026-09-14",
    "assessor": "yohei/claude v0"
  },
  {
    "evaluator": "farai",
    "dimension": "M",
    "value": 3,
    "anchor": 3,
    "signals": [
      "farai.08"
    ],
    "rationale": "Anchor 3 on methods given the cited signals.",
    "assessed": "2026-09-14",
    "assessor": "yohei/claude v0"
  },
  {
    "evaluator": "farai",
    "dimension": "X",
    "value": 3,
    "anchor": 3,
    "signals": [
      "farai.09"
    ],
    "rationale": "Anchor 3 on products given the cited signals.",
    "assessed": "2026-09-14",
    "assessor": "yohei/claude v0"
  }
]
