[
  {
    "evaluator": "rand",
    "dimension": "F",
    "value": 3,
    "anchor": 3,
    "signals": [
      "rand.03",
      "rand.09",
      "rand.10"
    ],
    "rationale": "Anchor 3 on funding given the cited signals.",
    "assessed": "2026-09-15",
    "assessor": "yohei/claude v1.0"
  },
  {
    "evaluator": "rand",
    "dimension": "G",
    "value": 3,
    "anchor": 3,
    "signals": [
      "rand.01"
    ],
    "rationale": "Anchor 3 on governance given the cited signals.",
    "assessed": "2026-09-14",
    "assessor": "yohei/claude v0"
  },
  {
    "evaluator": "rand",
    "dimension": "P",
    "value": 3,
    "anchor": 3,
    "signals": [
      "rand.05"
    ],
    "rationale": "Anchor 3 on personnel given the cited signals.",
    "assessed": "2026-09-14",
    "assessor": "yohei/claude v0"
  },
  {
    "evaluator": "rand",
    "dimension": "A",
    "value": 3,
    "anchor": 3,
    "signals": [
      "rand.02"
    ],
    "rationale": "Anchor 3 on access given the cited signals.",
    "assessed": "2026-09-14",
    "assessor": "yohei/claude v0"
  },
  {
    "evaluator": "rand",
    "dimension": "S",
    "value": 3,
    "anchor": 3,
    "signals": [
      "rand.06"
    ],
    "rationale": "Anchor 3 on scope given the cited signals.",
    "assessed": "2026-09-14",
    "assessor": "yohei/claude v0"
  },
  {
    "evaluator": "rand",
    "dimension": "R",
    "value": 2,
    "anchor": 2,
    "signals": [
      "rand.04"
    ],
    "rationale": "Anchor 2 on publication given the cited signals.",
    "assessed": "2026-09-14",
    "assessor": "yohei/claude v0"
  },
  {
    "evaluator": "rand",
    "dimension": "M",
    "value": 2,
    "anchor": 2,
    "signals": [
      "rand.07"
    ],
    "rationale": "Anchor 2 on methods given the cited signals.",
    "assessed": "2026-09-14",
    "assessor": "yohei/claude v0"
  },
  {
    "evaluator": "rand",
    "dimension": "X",
    "value": 4,
    "anchor": 4,
    "signals": [
      "rand.08"
    ],
    "rationale": "Anchor 4 on products given the cited signals.",
    "assessed": "2026-09-14",
    "assessor": "yohei/claude v0"
  }
]
