[
  {
    "evaluator": "big4",
    "dimension": "F",
    "value": 2,
    "anchor": 2,
    "signals": [
      "big4.05"
    ],
    "rationale": "Anchor 2 on funding given the cited signals.",
    "assessed": "2026-09-14",
    "assessor": "yohei/claude v0"
  },
  {
    "evaluator": "big4",
    "dimension": "G",
    "value": 2,
    "anchor": 2,
    "signals": [
      "big4.01"
    ],
    "rationale": "Anchor 2 on governance given the cited signals.",
    "assessed": "2026-09-14",
    "assessor": "yohei/claude v0"
  },
  {
    "evaluator": "big4",
    "dimension": "P",
    "value": 2,
    "anchor": 2,
    "signals": [
      "big4.06"
    ],
    "rationale": "Anchor 2 on personnel given the cited signals.",
    "assessed": "2026-09-14",
    "assessor": "yohei/claude v0"
  },
  {
    "evaluator": "big4",
    "dimension": "A",
    "value": 1,
    "anchor": 1,
    "signals": [
      "big4.03"
    ],
    "rationale": "Anchor 1 on access given the cited signals.",
    "assessed": "2026-09-14",
    "assessor": "yohei/claude v0"
  },
  {
    "evaluator": "big4",
    "dimension": "S",
    "value": 2,
    "anchor": 2,
    "signals": [
      "big4.07",
      "big4.09"
    ],
    "rationale": "Anchor 2 on scope given the cited signals.",
    "assessed": "2026-09-15",
    "assessor": "yohei/claude v1.0"
  },
  {
    "evaluator": "big4",
    "dimension": "R",
    "value": 1,
    "anchor": 1,
    "signals": [
      "big4.04"
    ],
    "rationale": "Anchor 1 on publication given the cited signals.",
    "assessed": "2026-09-14",
    "assessor": "yohei/claude v0"
  },
  {
    "evaluator": "big4",
    "dimension": "M",
    "value": 1,
    "anchor": 1,
    "signals": [
      "big4.08"
    ],
    "rationale": "Anchor 1 on methods given the cited signals.",
    "assessed": "2026-09-14",
    "assessor": "yohei/claude v0"
  },
  {
    "evaluator": "big4",
    "dimension": "X",
    "value": 1,
    "anchor": 1,
    "signals": [
      "big4.02"
    ],
    "rationale": "Anchor 1 on products given the cited signals.",
    "assessed": "2026-09-14",
    "assessor": "yohei/claude v0"
  }
]
